{
  "$schema": "https://json-schema.org/draft/2020-12/schema",
  "$id": "https://github.com/HKati/pulse-release-gates-0.1/schemas/slsa_vsa_trusted_evidence_producer_report_v0.schema.json",
  "title": "PULSE SLSA VSA trusted evidence producer report v0",
  "type": "object",
  "additionalProperties": false,
  "required": [
    "schema_version",
    "report_type",
    "created_utc",
    "producer",
    "run_binding",
    "artifact_binding",
    "policy_binding",
    "verifier_binding",
    "evidence",
    "freshness",
    "recorded_signal_mode",
    "candidate_set",
    "producer_decision",
    "ok",
    "failed_checks",
    "warnings"
  ],
  "properties": {
    "schema_version": {
      "const": "slsa_vsa_trusted_evidence_producer_report_v0"
    },
    "report_type": {
      "const": "slsa_vsa_trusted_evidence_producer_report"
    },
    "created_utc": {
      "$ref": "#/$defs/date_time"
    },
    "producer": {
      "$ref": "#/$defs/producer"
    },
    "run_binding": {
      "$ref": "#/$defs/run_binding"
    },
    "artifact_binding": {
      "$ref": "#/$defs/artifact_binding"
    },
    "policy_binding": {
      "$ref": "#/$defs/policy_binding"
    },
    "verifier_binding": {
      "$ref": "#/$defs/verifier_binding"
    },
    "evidence": {
      "$ref": "#/$defs/evidence"
    },
    "freshness": {
      "$ref": "#/$defs/freshness"
    },
    "recorded_signal_mode": {
      "const": "recorded_signal_only"
    },
    "candidate_set": {
      "const": "slsa_vsa_recorded_intake_candidate"
    },
    "producer_decision": {
      "type": "string",
      "enum": [
        "TRUSTED_EVIDENCE_ACCEPTED",
        "TRUSTED_EVIDENCE_REJECTED"
      ]
    },
    "ok": {
      "type": "boolean"
    },
    "failed_checks": {
      "type": "array",
      "items": {
        "type": "string",
        "minLength": 1
      }
    },
    "warnings": {
      "type": "array",
      "items": {
        "type": "string",
        "minLength": 1
      }
    }
  },
  "$defs": {
    "sha256": {
      "type": "string",
      "pattern": "^[0-9a-fA-F]{64}$"
    },
    "nullable_sha256": {
      "type": [
        "string",
        "null"
      ],
      "pattern": "^[0-9a-fA-F]{64}$"
    },
    "sha40": {
      "type": "string",
      "pattern": "^[0-9a-fA-F]{40}$"
    },
    "non_empty_string": {
      "type": "string",
      "minLength": 1
    },
    "nullable_non_empty_string": {
      "type": [
        "string",
        "null"
      ],
      "minLength": 1
    },
    "date_time": {
      "type": "string",
      "format": "date-time",
      "pattern": "^[0-9]{4}-[0-9]{2}-[0-9]{2}T[0-9]{2}:[0-9]{2}:[0-9]{2}(\\.[0-9]+)?(Z|[+-][0-9]{2}:[0-9]{2})$",
      "minLength": 1
    },
    "nullable_date_time": {
      "type": [
        "string",
        "null"
      ],
      "format": "date-time",
      "pattern": "^[0-9]{4}-[0-9]{2}-[0-9]{2}T[0-9]{2}:[0-9]{2}:[0-9]{2}(\\.[0-9]+)?(Z|[+-][0-9]{2}:[0-9]{2})$"
    },
    "producer": {
      "type": "object",
      "additionalProperties": false,
      "required": [
        "producer_id",
        "producer_name",
        "producer_version",
        "producer_source",
        "ci_workflow_or_job_identity"
      ],
      "properties": {
        "producer_id": {
          "$ref": "#/$defs/non_empty_string"
        },
        "producer_name": {
          "$ref": "#/$defs/non_empty_string"
        },
        "producer_version": {
          "$ref": "#/$defs/non_empty_string"
        },
        "producer_source": {
          "$ref": "#/$defs/non_empty_string"
        },
        "ci_workflow_or_job_identity": {
          "$ref": "#/$defs/non_empty_string"
        }
      }
    },
    "run_binding": {
      "type": "object",
      "additionalProperties": false,
      "required": [
        "current_run_id",
        "current_run_number",
        "current_run_attempt",
        "current_run_key",
        "workflow_name",
        "job_name",
        "commit_sha",
        "release_candidate_id"
      ],
      "properties": {
        "current_run_id": {
          "$ref": "#/$defs/non_empty_string"
        },
        "current_run_number": {
          "$ref": "#/$defs/non_empty_string"
        },
        "current_run_attempt": {
          "$ref": "#/$defs/non_empty_string"
        },
        "current_run_key": {
          "$ref": "#/$defs/non_empty_string"
        },
        "workflow_name": {
          "$ref": "#/$defs/non_empty_string"
        },
        "job_name": {
          "$ref": "#/$defs/non_empty_string"
        },
        "commit_sha": {
          "$ref": "#/$defs/sha40"
        },
        "release_candidate_id": {
          "$ref": "#/$defs/non_empty_string"
        }
      }
    },
    "artifact_binding": {
      "type": "object",
      "additionalProperties": false,
      "required": [
        "subject_name",
        "subject_sha256",
        "resource_uri",
        "release_candidate_id",
        "artifact_digest_sha256",
        "subject_digest_matches",
        "resource_uri_matches",
        "release_candidate_matches",
        "artifact_digest_matches"
      ],
      "properties": {
        "subject_name": {
          "$ref": "#/$defs/non_empty_string"
        },
        "subject_sha256": {
          "$ref": "#/$defs/sha256"
        },
        "resource_uri": {
          "$ref": "#/$defs/non_empty_string"
        },
        "release_candidate_id": {
          "$ref": "#/$defs/non_empty_string"
        },
        "artifact_digest_sha256": {
          "$ref": "#/$defs/sha256"
        },
        "subject_digest_matches": {
          "type": "boolean"
        },
        "resource_uri_matches": {
          "type": "boolean"
        },
        "release_candidate_matches": {
          "type": "boolean"
        },
        "artifact_digest_matches": {
          "type": "boolean"
        }
      }
    },
    "policy_binding": {
      "type": "object",
      "additionalProperties": false,
      "required": [
        "expected_policy_id",
        "expected_policy_uri",
        "expected_policy_sha256",
        "evidence_policy_id",
        "evidence_policy_uri",
        "evidence_policy_sha256",
        "policy_identity_matches",
        "policy_digest_matches"
      ],
      "properties": {
        "expected_policy_id": {
          "$ref": "#/$defs/non_empty_string"
        },
        "expected_policy_uri": {
          "$ref": "#/$defs/non_empty_string"
        },
        "expected_policy_sha256": {
          "$ref": "#/$defs/sha256"
        },
        "evidence_policy_id": {
          "$ref": "#/$defs/nullable_non_empty_string"
        },
        "evidence_policy_uri": {
          "$ref": "#/$defs/nullable_non_empty_string"
        },
        "evidence_policy_sha256": {
          "$ref": "#/$defs/nullable_sha256"
        },
        "policy_identity_matches": {
          "type": "boolean"
        },
        "policy_digest_matches": {
          "type": "boolean"
        }
      }
    },
    "verifier_binding": {
      "type": "object",
      "additionalProperties": false,
      "required": [
        "expected_verifier_id",
        "evidence_verifier_id",
        "verifier_trusted"
      ],
      "properties": {
        "expected_verifier_id": {
          "$ref": "#/$defs/non_empty_string"
        },
        "evidence_verifier_id": {
          "$ref": "#/$defs/nullable_non_empty_string"
        },
        "verifier_trusted": {
          "type": "boolean"
        }
      }
    },
    "evidence": {
      "type": "object",
      "additionalProperties": false,
      "required": [
        "evidence_path",
        "evidence_sha256",
        "evidence_schema_version",
        "evidence_type",
        "time_verified",
        "verification_result",
        "expected_verified_level",
        "evidence_verified_levels",
        "verified_level_ok"
      ],
      "properties": {
        "evidence_path": {
          "$ref": "#/$defs/nullable_non_empty_string"
        },
        "evidence_sha256": {
          "$ref": "#/$defs/nullable_sha256"
        },
        "evidence_schema_version": {
          "enum": [
            "slsa_vsa_evidence_v0",
            null
          ]
        },
        "evidence_type": {
          "enum": [
            "slsa_vsa",
            null
          ]
        },
        "time_verified": {
          "$ref": "#/$defs/nullable_date_time"
        },
        "verification_result": {
          "enum": [
            "PASSED",
            "FAILED",
            null
          ]
        },
        "expected_verified_level": {
          "$ref": "#/$defs/non_empty_string"
        },
        "evidence_verified_levels": {
          "anyOf": [
            {
              "type": "array",
              "minItems": 1,
              "items": {
                "$ref": "#/$defs/non_empty_string"
              }
            },
            {
              "type": "null"
            }
          ]
        },
        "verified_level_ok": {
          "type": "boolean"
        }
      }
    },
    "freshness": {
      "type": "object",
      "additionalProperties": false,
      "required": [
        "freshness_result",
        "stale_vsa_evidence",
        "previous_run_artifact_reuse",
        "time_verified_current_run_match",
        "current_run_binding_ok"
      ],
      "properties": {
        "freshness_result": {
          "enum": [
            "fresh_current_run",
            "rejected_missing_vsa_evidence",
            "rejected_unreadable_vsa_evidence",
            "rejected_stale_vsa",
            "rejected_previous_run_artifact",
            "rejected_time_verified_current_run_mismatch",
            "rejected_ambiguous_freshness"
          ]
        },
        "stale_vsa_evidence": {
          "type": "boolean"
        },
        "previous_run_artifact_reuse": {
          "type": "boolean"
        },
        "time_verified_current_run_match": {
          "type": "boolean"
        },
        "current_run_binding_ok": {
          "type": "boolean"
        }
      }
    }
  },
  "allOf": [
    {
      "if": {
        "properties": {
          "ok": {
            "const": true
          }
        },
        "required": [
          "ok"
        ]
      },
      "then": {
        "properties": {
          "producer_decision": {
            "const": "TRUSTED_EVIDENCE_ACCEPTED"
          },
          "failed_checks": {
            "maxItems": 0
          },
          "artifact_binding": {
            "properties": {
              "subject_digest_matches": {
                "const": true
              },
              "resource_uri_matches": {
                "const": true
              },
              "release_candidate_matches": {
                "const": true
              },
              "artifact_digest_matches": {
                "const": true
              }
            }
          },
          "policy_binding": {
            "properties": {
              "evidence_policy_id": {
                "$ref": "#/$defs/non_empty_string"
              },
              "evidence_policy_uri": {
                "$ref": "#/$defs/non_empty_string"
              },
              "evidence_policy_sha256": {
                "$ref": "#/$defs/sha256"
              },
              "policy_identity_matches": {
                "const": true
              },
              "policy_digest_matches": {
                "const": true
              }
            }
          },
          "verifier_binding": {
            "properties": {
              "evidence_verifier_id": {
                "$ref": "#/$defs/non_empty_string"
              },
              "verifier_trusted": {
                "const": true
              }
            }
          },
          "evidence": {
            "properties": {
              "evidence_path": {
                "$ref": "#/$defs/non_empty_string"
              },
              "evidence_sha256": {
                "$ref": "#/$defs/sha256"
              },
              "evidence_schema_version": {
                "const": "slsa_vsa_evidence_v0"
              },
              "evidence_type": {
                "const": "slsa_vsa"
              },
              "time_verified": {
                "$ref": "#/$defs/date_time"
              },
              "verification_result": {
                "const": "PASSED"
              },
              "evidence_verified_levels": {
                "type": "array",
                "minItems": 1,
                "items": {
                  "$ref": "#/$defs/non_empty_string"
                }
              },
              "verified_level_ok": {
                "const": true
              }
            }
          },
          "freshness": {
            "properties": {
              "freshness_result": {
                "const": "fresh_current_run"
              },
              "stale_vsa_evidence": {
                "const": false
              },
              "previous_run_artifact_reuse": {
                "const": false
              },
              "time_verified_current_run_match": {
                "const": true
              },
              "current_run_binding_ok": {
                "const": true
              }
            }
          }
        }
      }
    },
    {
      "if": {
        "properties": {
          "ok": {
            "const": false
          }
        },
        "required": [
          "ok"
        ]
      },
      "then": {
        "properties": {
          "producer_decision": {
            "const": "TRUSTED_EVIDENCE_REJECTED"
          },
          "failed_checks": {
            "minItems": 1
          }
        }
      }
    }
  ]
}
